7372,Prepackaged Software (mass reproduction of software),5*****,Multiple
7373,Computer Integrated Systems Design,541512,Computer Systems Design Services
7374,Computer Processing and Data Preparation and Processing Services,518210,"Data Processing, Hosting, and Related Services "
7375,Information Retrieval Services (Internet service providers and Internet access providers),518111,Internet Service Providers
7376,Computer Facilities Management Services,541513,Computer Facilities Management Services
7377,Computer Rental and Leasing,532420,Office Machinery and Equipment Rental and Leasing
7378,Computer Maintenance and Repair (sales locations providing supporting repair services as major source of receipts),******,Multiple
7379,"Computer Related Services, NEC (disk conversion services)",5*****,Multiple
7381,"Detective, Guard, and Armored Car Services (detective services)",5616**,Multiple
7382,Security Systems Services,561621,Security Systems Services (except Locksmiths)
7383,News Syndicates (except independent news correspondents),******,Multiple
7384,Photofinishing Laboratories (except one-hour),******,Multiple
7389,"Business Services, NEC (tobacco sheeting service)",******,Multiple
7513,Truck Rental and Leasing Without Drivers,532120,"Truck, Utility Trailer, and RV (Recreational Vehicle) Rental and Leasing"
7514,Passenger Car Rental,532111,Passenger Car Rental
7515,Passenger Car Leasing,532112,Passenger Car Leasing  
7519,Utility Trailers and Recreational Vehicle Rental,532120,"Truck, Utility Trailer, and RV (Recreational Vehicle) Rental and Leasing"
7521,Automobile Parking,812930,Parking Lots and Garages
7532,"Top, Body, and Upholstery Repair Shops and Paint Shops",811121,"Automotive Body, Paint, and Interior Repair and Maintenance "
7533,Automotive Exhaust System Repair Shops,811112,Automotive Exhaust System Repair
7534,Tire Retreading and Repair Shops (rebuilding tires and retreaded tire manufacturing),8111**,Multiple
7536,Automotive Glass Replacement Shops,811122,Automotive Glass Replacement Shops
7537,Automotive Transmission Repair Shops,811113,Automotive Transmission Repair
7538,General Automotive Repair Shops,811111,General Automotive Repair
7539,"Automotive Repair Shops, NEC (except automotive air-conditioning repair)",81119*,Multiple
7542,Carwashes,811192,Car Washes
7549,"Automotive Services, Except Repair and Carwashes (towing)",******,Multiple
7622,Radio and Television Repair Shops (household antenna installation and household-type satellite dish installation),******,Multiple
7623,Refrigeration and Air-Conditioning Services and Repair Shops (new retail sales combined with repair-repair services as major source of receipts),******,Multiple
7629,"Electrical and Electronic Repair Shops, NEC (new retail sales combined with repair-repair services as major source of receipts)",******,Multiple
7631,"Watch, Clock, and Jewelry Repair (new retail sales combined with repair-repair services as major source of receipts)",8114**,Multiple
7641,Reupholstery and Furniture Repair,811420,Reupholstery and Furniture Repair
7692,Welding Repair,811310,Commercial and Industrial Machinery and Equipment (except Automotive and Electronic) Repair and Maintenance
7694,Armature Rewinding Shops (remanufacturing),******,Multiple
7699,"Repair Shops and Related Services, NEC (farriers)",******,Multiple
7812,Motion Picture and Video Tape Production,512110,Motion Picture and Video Production
7819,Services Allied to Motion Picture Production (reproduction of video),******,Multiple
7822,Motion Picture and Video Tape Distribution (prerecorded video tape and cassette wholesalers),512120,Multiple
7829,Services Allied to Motion Picture Distribution (commercial distribution film libraries),51****,Multiple
7832,"Motion Picture Theaters, Except Drive-In",512131,Motion Picture Theaters (except Drive-Ins)
7833,Drive-In Motion Picture Theaters,512132,Drive-In Motion Picture Theaters
7841,Video Tape Rental,532230,Video Tape and Disc Rental
7911,"Dance Studios, Schools, and Halls (dance instructors, and professional and other dance schools)",******,Multiple
7922,Theatrical Producers (Except Motion Picture) and Miscellaneous Theatrical Services (producers of radio programs),******,Multiple
7929,"Bands, Orchestras, Actors, and Other Entertainers Entertainment Groups (musical groups, musical artists, and orchestras)",71****,Multiple
7933,Bowling Centers,713950,Bowling Centers
7941,Professional Sports Clubs and Promoters (professional sports clubs),711***,Multiple
7948,"Racing, Including Track Operations (track operations)",71****,Multiple
7991,Physical Fitness Facilities,713940,Fitness and Recreational Sports Centers
7992,Public Golf Courses,713910,Golf Courses and Country Clubs
7993,Coin-Operated Amusement Devices (amusement arcades),713***,Multiple
7996,Amusement Parks,713110,Amusement and Theme Parks
7997,Membership Sports and Recreation Clubs (flying clubs primarily providing a variety of flying services to the public using general purpose aircraft),******,Multiple
7999,"Amusement and Recreation Services, NEC (scenic transport operations, land)",******,Multiple
8011,"Offices and Clinics of Doctors of Medicine (except mental health specialists, HMO medical centers, and ambulatory surgical and emergency centers)",621***,Multiple
8021,Offices and Clinics of Dentists,621210,Offices of Dentists
8031,Offices and Clinics of Doctors of Osteopathy (except mental health specialists) ,621***,Multiple
8041,Offices and Clinics of Chiropractors,621310,Offices of Chiropractors
8042,Offices and Clinics of Optometrists,621320,Offices of Optometrists
8043,Offices and Clinics of Podiatrists,621391,Offices of Podiatrists
8049,"Offices and Clinics of Health Practitioners, NEC (mental health practitioners except physicians)",62****,Multiple
8051,Skilled Nursing Care Facilities (except continuing care retirement communities and mental retardation hospitals),623***,Multiple
8052,Intermediate Care Facilities (except continuing care retirement communities and mental retardation facilities),623***,Multiple
8059,"Nursing and Personal Care Facilities, NEC (except continuing care retirement communities, psychiatric convalescent homes with health care, and homes for the mentally retarded with health care)",62****,Multiple
8062,General Medical and Surgical Hospitals,622110,General Medical and Surgical Hospitals
8063,Psychiatric Hospitals,622210,Psychiatric and Substance Abuse Hospitals
8069,"Specialty Hospitals, Except Psychiatric (children’s hospitals)",62****,Multiple
8071,Medical Laboratories (except diagnostic imaging centers),******,Multiple
8072,Dental Laboratories,339116,Dental Laboratories
8082,Home Health Care Services,621610,Home Health Care Services
8092,Kidney Dialysis Centers,621492,Kidney Dialysis Centers
8093,"Specialty Outpatient Facilities, NEC (respiratory therapy clinics and offices)",******,Multiple
8099,"Health and Allied Services, NEC (medical artists)",******,Multiple
8111,Legal Services,541110,Offices of Lawyers 
8211,Elementary and Secondary Schools,611110,Elementary and Secondary Schools
8221,"Colleges, Universities, and Professional Schools",611310,"Colleges, Universities, and Professional Schools"
8222,Junior Colleges and Technical Institutes,611210,Junior Colleges
8231,Libraries,519120,Libraries and Archives
8243,Data Processing Schools (except computer repair training),611***,Multiple
8244,Business and Secretarial Schools,611410,Business and Secretarial Schools
8249,"Vocational Schools, NEC (aviation schools, excluding flying instruction)",611***,Multiple
8299,"Schools and Educational Services, NEC (professional and management development training)",6*****,Multiple
8322,Individual and Family Social Services (child and youth services),******,Multiple
8331,Job Training and Vocational Rehabilitation Services,624310,Vocational Rehabilitation Services
8351,Child Day Care Services,624410,Child Day Care Services
8361,Residential Care (homes for the mentally handicapped with incidental health care),******,Multiple
8399,"Social Services, NEC (voluntary health organizations)",******,Multiple
8412,Museums and Art Galleries (except historic and heritage sites),7121**,Multiple
8422,Arboreta and Botanical or Zoological Gardens (except nature parks and reserves),******,Multiple
8611,Business Associations,813910,Business Associations
8621,Professional Membership Organizations,813920,Professional Organizations
8631,Labor Unions and Similar Labor Organizations,813930,Labor Unions and Similar Labor Organizations
8641,"Civic, Social, and Fraternal Associations (taxpayers' associations, tenants' advocacy associations, temperance organizations)",******,Multiple
8651,Political Organizations,813940,Political Organizations
8661,Religious Organizations,813110,Religious Organizations
8699,"Membership Organizations, NEC (travel motor clubs)",******,Multiple
8711,Engineering Services,541330,Engineering Services
8712,Architectural Services,541310,Architectural  Services
8713,Surveying Services (geophysical surveying ),541***,Multiple
8721,"Accounting, Auditing, and Bookkeeping Services (auditing  accountants)",541***,Multiple
8731,Commercial Physical and Biological Research,541710,"Research and Development in the Physical, Engineering, and Life Sciences"
8732,"Commercial Economic, Sociological, and Educational Research (social sciences and humanities)",541***,Multiple
8733,"Noncommercial Research Organizations (physical, engineering, and life sciences)",541***,Multiple
8734,Testing Laboratories (except veterinary testing laboratories),******,Multiple
8741,Management Services (single-family housing construction management),******,Multiple
8742,Management Consulting Services (administrative management and general management consulting),541***,Multiple
8743,Public Relations Services,541820,Public Relations Agencies
8744,Facilities Support Management Services,561210,Facilities Support Services
8748,"Business Consulting Services, NEC (urban planners and industrial development organizations)",******,Multiple
8811,Private Households,814110,Private Households
8999,"Services, NEC (record production)",******,Multiple
9111,Executive Offices,921110,Executive Offices
9121,Legislative Bodies,921120,Legislative Bodies
9131,Executive and Legislative Office Combined ,921140,"Executive and Legislative Offices, Combined "
9199,"General Government, NEC",921190,Other General Government Support
9211,Courts,922110,Courts
9221,Police Protection,922120,Police Protection
9222,Legal Counsel and Prosecution,922130,Legal Counsel and Prosecution
9223,Correctional Institutions,922140,Correctional Institutions
9224,Fire Protection,922160,Fire Protection
9229,"Public Order and Safety, NEC",922190,"All Other Justice, Public Order, and Safety Activities"
9311,"Public Finance, Taxation, and Monetary Policy",921130,Public Finance Activities
9411,Administration of Educational Programs,923110,Administration of Education Programs
9431,Administration of Public Health Programs,923120,Administration of Public Health Programs
9441,"Administration of Social, Human Resource and Income Maintenance Programs",923130,"Administration of Human Resource Programs (except Education, Public Health, and Veteran’s Affairs Programs)"
9451,"Administration of Veterans’ Affairs, Except Health and Insurance",923140,Administration of Veteran’s Affairs
9511,Air and Water Resource and Solid Waste Management,924110,Administration of Air and Water Resource and Solid Waste Management Programs
9512,"Land, Mineral, Wildlife, and Forest Conservation",924120,Administration of Conservation Programs
9531,Administration of Housing Programs,925110,Administration of Housing Programs
9532,Administration of Urban Planning and Community and Rural Development,925120,Administration of Urban Planning and Community and Rural Development
9611,Administration of General Economic Programs,926110,Administration of General Economic Programs
9621,Regulation and Administration of Transportation Programs (government air traffic control),9261**,Multiple
9631,"Regulation and Administration of Communications, Electric, Gas, and Other Utilities",926130,"Regulation and Administration of Communications, Electric, Gas, and Other Utilities"
9641,Regulation of Agricultural Marketing and Commodities,926140,Regulation of Agricultural Marketing and Commodities
9651,"Regulation, Licensing, and Inspection of Miscellaneous Commercial Sectors",926150,"Regulation, Licensing, and Inspection of Miscellaneous Commercial Sectors"
9661,Space Research and Technology,927110,Space Research and Technology
9711,National Security,928110,National Security
9721,International Affairs,928120,International Affairs
,These establishments were included as auxiliaries in the 1987 Standard Industrial Classification,551114,"Corporate, Subsidiary, and Regional Managing Offices"
,Null Set for U.S.,112130,Dual Purpose Cattle Ranching and Farming
,Null Set for U.S.,541120,Offices of Notaries
,,,
