4212,Local Trucking Without Storage (general freight),******,Multiple
4213,"Trucking, Except Local (general freight, truckload)",484***,Multiple
4214,Local Trucking With Storage (general freight),4(8|9)****,Multiple
4215,"Courier Services, Except by Air (hub and spoke intercity delivery)",49****,Multiple
4221,Farm Product Warehousing and Storage,493130,Farm Product Warehousing and Storage
4222,Refrigerated Warehousing and Storage,493120,Refrigerated Warehousing and Storage
4225,General Warehousing and Storage (except self-storage and miniwarehouses),******,Multiple
4226,"Special Warehousing and Storage, NEC (warehousing in foreign trade zones)",4(8|9)****,Multiple
4231,Terminal and Joint Terminal Maintenance Facilities for Motor Freight Transportation,488490,Other Support Activities for Road Transportation
4311,United States Postal Service,491110,Postal Service
4412,Deep Sea Foreign Transportation of Freight,483111,Deep Sea Freight Transportation
4424,Deep Sea Domestic Transportation of Freight,483113,Coastal and Great Lakes Freight Transportation
4432,Freight Transportation on the Great Lakes - St. Lawrence Seaway,483113,Coastal and Great Lakes Freight Transportation
4449,"Water Transportation of Freight, NEC",483211,Inland Water Freight Transportation
4481,"Deep Sea Transportation of Passengers, Except by Ferry (deep sea activities)",483114,Multiple
4482,Ferries (coastal and Great Lakes),483212,Multiple
4489,"Water Transportation of Passengers, NEC (water taxi)",48****,Multiple
4491,Marine Cargo Handling (dock and pier operations),4883**,Multiple
4492,Towing and Tugboat Services ,488330,Navigational Services to Shipping
4493,Marinas,713930,Marinas
4499,"Water Transportation Services, NEC (lighterage)",******,Multiple
4512,"Air Transportation, Scheduled (passenger)",4(8|9)****,Multiple
4513,Air Courier Services,492110,Couriers
4522,"Air Transportation, Nonscheduled (passenger)",******,Multiple
4581,"Airports, Flying Fields, and Airport Terminal Services (private air traffic control)",******,Multiple
4612,Crude Petroleum Pipelines,486110,Pipeline Transportation of Crude Oil
4613,Refined Petroleum Pipelines,486910,Pipeline Transportation of Refined Petroleum Products
4619,"Pipelines, NEC",486990,All Other Pipeline Transportation
4724,Travel Agencies,561510,Travel Agencies
4725,Tour Operators,561520,Tour Operators
4729,"Arrangement of Passenger Transportation, NEC (arrangement of carpools and vanpools)",******,Multiple
4731,"Arrangement of Transportation of Freight and Cargo (except freight rate auditors, private mail centers, and tariff consultants)",******,Multiple
4741,"Rental of Railroad Cars (grain leveling in railroad cars, grain trimming for railroad equipment, precooling of fruits and vegetables in connection with transportation, and railroad car cleaning, icing, ventilating, and heating)",******,Multiple
4783,Packing and Crating,488991,Packing and Crating
4785,Fixed Facilities and Inspection and Weighing Services for Motor Vehicle Transportation (marine cargo checkers),48****,Multiple
4789,"Transportation Services, NEC (horse-drawn cabs and carriages)",******,Multiple
4812,Radiotelephone Communications (paging carriers),517***,Multiple
4813,"Telephone Communications, Except Radiotelephone (except resellers)",517***,Multiple
4822,Telegraph and Other Message Communications,517110,Wired Telecommunications Carriers
4832,Radio Broadcasting Stations (networks),5151**,Multiple
4833,Television Broadcasting Stations ,515120,Television Broadcasting 
4841,Cable and Other Pay Television Services (cable networks),******,Multiple
4899,"Communications Services, NEC (radio broadcasting operated by cab companies)",******,Multiple
4911,Electric Services (hydroelectric power generation),******,Multiple
4922,Natural Gas Transmission,486210,Pipeline Transportation of Natural Gas
4923,Natural Gas Transmission and Distribution (distribution),******,Multiple
4924,Natural Gas Distribution,221210,Natural Gas Distribution
4925,"Mixed, Manufactured, or Liquefied Petroleum Gas Production and/or Distribution",221210,Natural Gas Distribution
4931,Electric and Other Services Combined (hydroelectric power generation) ,221***,Multiple
4932,Gas and Other Services Combined (natural gas distribution),221210,Natural Gas Distribution
4939,"Combination Utilities, NEC (hydroelectric power generation)",221***,Multiple
4941,Water Supply,221310,Water Supply and Irrigation Systems
4952,Sewerage Systems,221320,Sewage Treatment Facilities
4953,Refuse Systems (hazardous waste treatment and disposal),******,Multiple
4959,"Sanitary Services, NEC (vacuuming of runways)",******,Multiple
4961,Steam and Air-Conditioning Supply,221330,Steam and Air-Conditioning Supply
4971,Irrigation Systems,221310,Water Supply and Irrigation Systems
5012,Automobiles and Other Motor Vehicles (merchant wholesalers),42****,Multiple
5013,Motor Vehicle Supplies and New Parts (merchant wholesalers except those selling via retail method) ,4*****,Multiple
5014,Tires and Tubes (merchant wholesalers except those selling via retail method),4*****,Multiple
5015,"Motor Vehicle Parts, Used (merchant wholesalers except those selling via retail method)",4*****,Multiple
5021,Furniture (merchant wholesalers except those selling via retail method),4*****,Multiple
5023,Homefurnishings (merchant wholesalers except those selling via retail method),4*****,Multiple
5031,"Lumber, Plywood, Millwork, and Wood Panels (merchant wholesalers)",4*****,Multiple
5032,"Brick, Stone, and Related Construction Materials  (merchant wholesalers except construction materials sold via retail method)",4*****,Multiple
5033,"Roofing, Siding, and Insulation Materials (merchant wholesalers except those selling via retail method)",4*****,Multiple
5039,"Construction Materials, NEC (merchant wholesalers of prefabricated buildings and structural assemblies, wood)",4*****,Multiple
5043,Photographic Equipment and Supplies (merchant wholesalers),42****,Multiple
5044,Office Equipment (merchant wholesalers except those selling office equipment via retail method),4*****,Multiple
5045,"Computers and Computer Peripheral Equipment and Software (merchant wholesalers except those selling computers, equipment, and software via retail method)",4*****,Multiple
5046,"Commercial Equipment, NEC (merchant wholesalers)",42****,Multiple
5047,"Medical, Dental and Hospital Equipment and Supplies (merchant wholesalers except those selling medical, dental, and hospital equipment and supplies via retail method)",4*****,Multiple
5048,Ophthalmic Goods (merchant wholesalers),42****,Multiple
5049,"Professional Equipment and Supplies, NEC (merchant wholesalers except those selling religious and teacher's school supplies via retail method) ",4*****,Multiple
5051,Metals Service Centers and Offices (merchant wholesalers) ,42****,Multiple
5052,Coal and Other Minerals and Ores (merchant wholesalers),42****,Multiple
5063,"Electrical Apparatus and Equipment, Wiring Supplies and Construction Materials (merchant wholesalers except those selling electrical supplies, equipment, and apparatus via retail method)",4*****,Multiple
5064,"Electrical Appliances, Television and Radio Sets (merchant wholesalers except those selling appliances, TVs, and radios via retail method)",4*****,Multiple
5065,"Electronic Parts and Equipment, NEC (merchant wholesalers except those selling electronic parts and equipment via retail method)",4*****,Multiple
5072,Hardware (merchant wholesalers except those selling hardware via retail method),4*****,Multiple
5074,Plumbing and Heating Equipment and Supplies (Hydronics) (merchant wholesalers except those selling  plumbing and hydronic heating equipment via retail method),4*****,Multiple
5075,Warm Air Heating and Air-Conditioning Equipment and Supplies (merchant wholesalers),42****,Multiple
5078,Refrigeration Equipment and Supplies (merchant wholesalers),42****,Multiple
5082,Construction and Mining (Except Petroleum) Machinery and Equipment (merchant wholesalers),42****,Multiple
5083,Farm and Garden Machinery and Equipment (merchant wholesalers except those selling lawn and garden equipment via retail method),4*****,Multiple
5084,Industrial Machinery and Equipment (merchant wholesalers),42****,Multiple
5085,Industrial Supplies (merchant wholesalers of fluid power accessories),4*****,Multiple
5087,Service Establishment Equipment and Supplies (merchant wholesalers except those selling beauty and barber shop equipment and supplies via retail method),4*****,Multiple
5088,"Transportation Equipment and Supplies, Except Motor Vehicles (merchant wholesalers)",42****,Multiple
5091,Sporting and Recreational Goods and Supplies (merchant wholesalers except those selling sporting and recreational goods via retail method),4*****,Multiple
5092,Toys and Hobby Goods and Supplies (merchant wholesalers except those selling toys and hobby goods and supplies via retail method),4*****,Multiple
5093,Scrap and Waste Materials (merchant wholesalers),42****,Multiple
5094,"Jewelry, Watches, Precious Stones, and Precious Metals (merchant wholesalers except those selling jewelry and related goods via retail method)",4*****,Multiple
5099,"Durable Goods, NEC (merchant wholesalers except those selling miscellaneous durable goods via retail method)",4*****,Multiple
5111,Printing and Writing Paper (merchant wholesalers except those selling printing and writing paper via retail method),4*****,Multiple
5112,Stationery and Office Supplies (merchant wholesalers except those selling stationery and office supplies via retail method),4*****,Multiple
5113,Industrial and Personal Service Paper (merchant wholesalers except those selling industrial and personal service paper via retail method),4*****,Multiple
5122,"Drugs, Drug Proprietaries, and Druggists’ Sundries (merchant wholesalers except those selling drugs and sundries via retail method)",******,Multiple
5131,"Piece Goods, Notions, and Other Dry Goods (broadwoven converters)",******,Multiple
5136,Men's and Boys' Clothing and Furnishings (merchant wholesalers of athletic uniforms),4*****,Multiple
5137,"Women's, Children's and Infants' Clothing and Accessories (merchant wholesalers of athletic uniforms)",4*****,Multiple
5139,Footwear (merchant wholesalers except those selling footwear via retail method),4*****,Multiple
5141,"Groceries, General Line (merchant wholesalers except those selling general line groceries via retail method)",4*****,Multiple
5142,Packaged Frozen Foods (merchant wholesalers except those selling packaged frozen foods via retail method),4*****,Multiple
5143,"Dairy Products, Except Dried or Canned (merchant wholesalers except those selling dairy products via retail method)",4*****,Multiple
5144,Poultry and Poultry Products (merchant wholesalers except those selling poultry and poultry products via retail method),4*****,Multiple
5145,Confectionery (merchant wholesalers except those selling confectionery via retail method),4*****,Multiple
5146,Fish and Seafoods (merchant wholesalers except those selling fish and seafoods via retail method),******,Multiple
5147,Meats and Meat Products (boxed beef),4*****,Multiple
5148,Fresh Fruits and Vegetables (merchant wholesalers except those selling fresh fruits and vegetables via retail method),******,Multiple
5149,"Groceries and Related Products, NEC (processed bottled water manufacturing) ",4*****,Multiple
5153,Grain and Field Beans (merchant wholesalers except those selling grains and field beans via retail method),4*****,Multiple
5154,Livestock (merchant wholesalers),42****,Multiple
5159,"Farm-Product Raw Materials, NEC (merchant wholesalers except those selling farm product raw materials, nec via retail method)",4*****,Multiple
5162,Plastics Materials and Basic Forms and Shapes (merchant wholesalers except those selling plastics via retail method),4*****,Multiple
5169,"Chemicals and Allied Products, NEC (merchant wholesalers)",42****,Multiple
5171,Petroleum Bulk Stations and Terminals (except petroleum sold via retail method),4*****,Multiple
5172,"Petroleum and Petroleum Products Wholesalers, Except Bulk Stations and Terminals (merchant wholesalers)",42****,Multiple
5181,Beer and Ale (merchant wholesalers except those selling beer and ale via retail method),4*****,Multiple
5182,Wine and Distilled Alcoholic Beverages (merchant wholesalers except those selling wine and distilled beverages via retail method),4*****,Multiple
5191,Farm Supplies (merchant wholesalers except those selling lawn and garden supplies via retail method),4*****,Multiple
5192,"Books, Periodicals, and Newspapers (merchant wholesalers except those selling publications via retail method)",4*****,Multiple
5193,"Flowers, Nursery Stock, and Florists’ Supplies (merchant wholesalers except those selling nursery stock via retail method)",4*****,Multiple
5194,Tobacco and Tobacco Products (merchant wholesalers except those selling tobacco and tobacco products via retail method),4*****,Multiple
5198,"Paints, Varnishes, and Supplies (merchant wholesalers) ",42****,Multiple
5199,"Nondurable Goods, NEC (merchant wholesalers of yarns, except industrial)",******,Multiple
5211,Lumber and Other Building Materials Dealers (home center stores),4441**,Multiple
5231,"Paint, Glass, and Wallpaper Stores (except glass)",4441**,Multiple
5251,Hardware Stores,444130,Hardware Stores
5261,"Retail Nurseries, Lawn and Garden Supply Stores (outdoor power equipment)",4(4|5)****,Multiple
5271,Mobile Home Dealers,453930,Manufactured (Mobile) Home Dealers
5311,Department Stores (except discount department stores and supercenters-general merchandise and groceries),452***,Multiple
5331,Variety Stores,452990,All Other General Merchandise Stores
5399,Miscellaneous General Merchandise Stores (warehouse clubs and supermarket/general merchandise combination),4(4|5)****,Multiple
5411,"Grocery Stores (except convenience stores, freezer plans, and grocery stores with substantial general merchandise)",4(4|5)****,Multiple
5421,"Meat and Fish (Seafood) Markets, Including Freezer Provisioners (meat except freezer provisioners)",4(4|5)****,Multiple
5431,Fruit and Vegetable Markets (except temporary fruit and vegetable stands),******,Multiple
5441,"Candy, Nut, and Confectionery Stores (chocolate candy stores, preparing on premises)",******,Multiple
5451,Dairy Products Stores,445299,All Other Specialty Food Stores
5461,"Retail Bakeries (bread, cake and related products baked and sold on premise)",******,Multiple
5499,Miscellaneous Food Stores (poultry and poultry products),44****,Multiple
5511,Motor Vehicle Dealers (New and Used),441110,New Car Dealers
5521,Motor Vehicle Dealers (Used Only),441120,Used Car Dealers
5531,Auto and Home Supply Stores (auto supply stores),4(4|5)****,Multiple
5541,Gasoline Service Station (gasoline station with convenience store),44****,Multiple
5551,Boat Dealers ,441222,Boat Dealers
5561,Recreational Vehicle Dealers,441210,Recreational Vehicle Dealers
5571,Motorcycle Dealers,441221,Motorcycle Dealers
5599,"Automotive Dealers, NEC",441229,All Other Motor Vehicle Dealers
5611,Men's and Boys' Clothing and Accessory Stores (clothing stores),4481**,Multiple
5621,Women's Clothing Stores (except dress shops and bridal shops),4481**,Multiple
5632,Women's Accessory and Specialty Stores (accessories),4481**,Multiple
5641,Children's and Infants’ Wear Stores,448130,Children's and Infants' Clothing Stores
5651,Family Clothing Stores,448140,Family Clothing Stores
5661,Shoe Stores,448210,Shoe Stores
5699,Miscellaneous Apparel and Accessory Stores (custom tailors),******,Multiple
5712,Furniture Stores (custom wood cabinets),******,Multiple
5713,Floor Coverings Stores,442210,Floor Covering Stores
5714,"Drapery, Curtain, and Upholstery Stores (custom drapes)",******,Multiple
5719,Miscellaneous Homefurnishings Stores (manufacturing and selling pottery on site),44****,Multiple
5722,Household Appliance Stores,443111,Household Appliance Stores
5731,"Radio, Television, and Consumer Electronics Stores (automobile radios)",4431**,Multiple
5734,Computer and Computer Software Stores,443120,Computer and Software Stores
5735,Record and Prerecorded Tape Stores,451220,"Prerecorded Tape, Compact Disc, and Record Stores"
5736,Musical Instruments Stores,451140,Musical Instrument and Supplies Stores
5812,Eating Places (dinner theaters),722***,Multiple
5813,Drinking Places (Alcoholic Beverages),722410,Drinking Places (Alcoholic Beverages)
5912,Drug Stores and Proprietary Stores,446110,Pharmacies and Drug Stores
5921,Liquor Stores,445310,"Beer, Wine, and Liquor Stores"
5932,Used Merchandise Stores (except pawn shops),******,Multiple
5941,Sporting Goods Stores and Bicycle Shops,451110,Sporting Goods Stores
5942,Book Stores,451211,Book Stores
5943,Stationery Stores,453210,Office Supplies and Stationery Stores
5944,Jewelry Stores,448310,Jewelry Stores
5945,"Hobby, Toy, and Game Stores",451120,"Hobby, Toy, and Game Stores"
5946,Camera and Photographic Supply Stores,443130,Camera and Photographic Supplies Stores
5947,"Gift, Novelty, and Souvenir Shops",453220,"Gift, Novelty, and Souvenir Stores"
5948,Luggage and Leather Goods Stores,448320,Luggage and Leather Goods Stores
5949,"Sewing, Needlework, and Piece Goods Stores",451130,"Sewing, Needlework, and Piece Goods Stores"
5961,Catalog and Mail-Order Houses (electronic shopping web sites),454***,Multiple
5962,Automatic Merchandise Machine Operators,454210,Vending Machine Operators
5963,Direct Selling Establishments (except mobile food services and food wagons),******,Multiple
5983,Fuel Oil Dealers,454311,Heating Oil Dealers
5984,Liquefied Petroleum Gas (Bottled Gas) Dealers,454312,Liquefied Petroleum Gas (Bottled Gas) Dealers
5989,"Fuel Dealers, NEC",454319,Other Fuel Dealers
5992,Florists,453110,Florists
5993,Tobacco Stores and Stands,453991,Tobacco Stores
5994,News Dealers and Newsstands ,451212,News Dealers and Newsstands
5995,Optical Goods Stores (optical laboratories grinding lenses to prescription),******,Multiple
5999,"Miscellaneous Retail Stores, NEC (manufacture of orthopedic devices to prescription in a retail environment)",******,Multiple
6011,Federal Reserve Banks,521110,Monetary Authorities - Central Bank
6019,"Central Reserve Depository Institutions, NEC",522298,All Other Nondepository Credit Intermediation
6021,National Commercial Banks (banking),522***,Multiple
6022,State Commercial Banks (commercial banking),522***,Multiple
6029,"Commercial Banks, NEC ",522110,Commercial Banking
6035,"Savings Institutions, Federally Chartered",522120,Savings Institutions
6036,"Savings Institutions, Not Federally Chartered",522120,Savings Institutions
6061,"Credit Unions, Federally Chartered",522130,Credit Unions
6062,"Credit Unions, Not Federally Chartered",522130,Credit Unions
6081,Branches and Agencies of Foreign Banks (branches),52229*,Multiple
6082,Foreign Trade and International Banking Institutions (international trade financing),52****,Multiple
6091,Nondeposit Trust Facilities ,523991,"Trust, Fiduciary, and Custody Activities"
6099,"Functions Related to Depository Banking, NEC (electronic funds transfer networks and clearinghouse associations)",52****,Multiple
6111,Federal and Federally-Sponsored Credit Agencies (trade banks),5222**,Multiple
6141,Personal Credit Institutions (credit card issuing),5222**,Multiple
6153,"Short-Term Business Credit Institutions, Except Agricultural (credit card issuing)",52****,Multiple
6159,Miscellaneous Business Credit Institutions (finance leasing combined with sales financing),52229*,Multiple
6162,Mortgage Bankers and Loan Correspondents (mortgage bankers and originators),5223**,Multiple
6163,Loan Brokers,522310,Mortgage and Nonmortgage Loan Brokers
6211,"Security Brokers, Dealers, and Flotation Companies (security dealers and underwriters)",523***,Multiple
6221,Commodity Contracts Brokers and Dealers (commodity dealers),523***,Multiple
6231,Security and Commodity Exchanges,523210,Securities and Commodity Exchanges
6282,Investment Advice (portfolio managers),5239**,Multiple
6289,"Services Allied With the Exchange of Securities or Commodities, NEC (security custodians)",52****,Multiple
6311,Life Insurance (life insurers-direct),5241**,Multiple
6321,Accident and Health Insurance (disability insurers-direct),52****,Multiple
6324,Hospital and Medical Service Plans (health and medical insurers-direct),52****,Multiple
6331,"Fire, Marine, and Casualty Insurance (fire, marine, and casualty insurers-direct, except contact lens insurance)",52****,Multiple
6351,Surety Insurance (financial responsibility insurers-direct),5241**,Multiple
6361,Title Insurance (title insurers-direct),52****,Multiple
6371,"Pension, Health, and Welfare Funds (managers)",52****,Multiple
6399,"Insurance Carriers, NEC",524128,"Other Direct Insurance (except Life, Health, and Medical) Carriers"
6411,"Insurance Agents, Brokers, and Service (insurance agents and brokers)",5*****,Multiple
6512,Operators of Nonresidential Buildings (except stadium and arena owners),******,Multiple
6513,Operators of Apartment Buildings,531110,Lessors of Residential Buildings and Dwellings
6514,Operators of Dwellings Other Than Apartment Buildings,531110,Lessors of Residential Buildings and Dwellings
6515,Operators of Residential Mobile Home Sites,531190,Lessors of Other Real Estate Property
6517,Lessors of Railroad Property,531190,Lessors of Other Real Estate Property
6519,"Lessors of Real Property, NEC",531190,Lessors of Other Real Estate Property
6531,Real Estate Agents and Managers (operating housing authorities),******,Multiple
6541,Title Abstract Offices,541191,Title Abstract and Settlement Offices
6552,"Land Subdividers and Developers, Except Cemeteries",237210,Land Subdivision
6553,Cemetery Subdividers and Developers,812220,Cemeteries and Crematories
6712,Offices of Bank Holding Companies,551111,Offices of  Bank Holding Companies
6719,"Offices of Holding Companies, NEC",551112,Offices of  Other Holding Companies
6722,"Management Investment Offices, Open-End ",525910,Open-End Investment Funds
6726,"Unit Investment Trusts, Face-Amount Certificate Offices, and Closed-End Management Investment Offices",525990,Other Financial Vehicles
6732,"Educational, Religious, and Charitable Trusts",813211,Grantmaking Foundations
6733,"Trusts, Except Educational, Religious, and Charitable (managers)",52****,Multiple
6792,Oil Royalty Traders (investing on own account),533110,Multiple
6794,Patent Owners and Lessors,533110,Lessors of Nonfinancial Intangible Assets (except Copyrighted Works)
6798,Real Estate Investment Trusts,525930,Real Estate Investment Trusts
6799,"Investors, NEC (commodity contract trading companies)",******,Multiple
7011,"Hotels and Motels (hotels, except casino hotels, and motels)",721***,Multiple
7021,Rooming and Boarding Houses,721310,Rooming and Boarding Houses
7032,Sporting and Recreational Camps,721214,Recreational and Vacation Camps (except Campgrounds)
7033,Recreational Vehicle Parks and Campsites,721211,RV (Recreational Vehicle) Parks and Campgrounds
7041,"Organization Hotels and Lodging Houses, on Membership Basis (hotels)",******,Multiple
7211,"Power Laundries, Family and Commercial",812320,Drycleaning and Laundry Services (except Coin-Operated)
7212,"Garment Pressing, and Agents for Laundries and Drycleaners",812320,Drycleaning and Laundry Services (except Coin-Operated)
7213,Linen Supply,812331,Linen Supply
7215,Coin-Operated Laundry and Drycleaning ,812310,Coin-Operated Laundries and Drycleaners
7216,"Drycleaning Plants, Except Rug Cleaning",812320,Drycleaning and Laundry Services (except Coin-Operated)
7217,Carpet and Upholstery Cleaning,561740,Carpet and Upholstery Cleaning Services
7218,Industrial Launderers,812332,Industrial Launderers
7219,"Laundry and Garment Services, NEC (alteration and repair)",******,Multiple
7221,"Photographic Studios, Portrait",541921,"Photography Studios, Portrait"
7231,Beauty Shops (beauty and cosmetology schools),******,Multiple
7241,Barber Shops (barber colleges),81****,Multiple
7251,Shoe Repair Shops and Shoeshine Parlors (shoe repair shops),812***,Multiple
7261,Funeral Services and Crematories (funeral homes and services),******,Multiple
7291,Tax Return Preparation Services,541213,Tax Preparation Services
7299,"Miscellaneous Personal Services, NEC (formal wear and costume rental)",******,Multiple
7311,Advertising Agencies,541810,Advertising Agencies
7312,Outdoor Advertising Services,541850,Display Advertising
7313,"Radio, Television, and Publishers’ Advertising Representatives",541840,Media Representatives
7319,"Advertising, NEC (using general purpose aircraft for aerial advertising and a variety of other services)",5*****,Multiple
7322,Adjustment and Collection Services,561440,Collection Agencies
7323,Credit Reporting Services,561450, Credit Bureaus
7331,Direct Mail Advertising Services (mailing list compilers),******,Multiple
7334,Photocopying and Duplicating Services (quick printing),******,Multiple
7335,Commercial Photography (using general purpose aircraft for aerial photography and a variety of other services),541***,Multiple
7336,Commercial Art and Graphic Design,541430,Graphic Design Services
7338,Secretarial and Court Reporting (secretarial services),561***,Multiple
7342,Disinfecting and Pest Control Services (exterminating and pest control),561720,Multiple
7349,"Building Cleaning and Maintenance Services, NEC (janitorial services)",5*****,Multiple
7352,Medical Equipment Rental and Leasing (home health furniture and equipment rental and leasing),******,Multiple
7353,Heavy Construction Equipment Rental and Leasing (rental of construction equipment [except cranes] with operator),******,Multiple
7359,"Equipment Rental and Leasing, NEC (appliances; TVs, VCRs, and other consumer electronic equipment rental)",5*****,Multiple
7361,Employment Agencies (executive placement services),5613**,Multiple
7363,Help Supply Services (temporary help services),5*****,Multiple
7371,Computer Programming Services,541511,Custom Computer Programming Services
